{
  "counts": {
    "error": 13,
    "findings": 26,
    "info": 1,
    "qualifying": 23,
    "warning": 12
  },
  "errors": [],
  "exitCode": 1,
  "findings": [
    {
      "certainty": "certain",
      "id": "x0db6370534429f1b",
      "kind": "foreign_key_extra",
      "label": "tenant_b.line_items.line_items_coupon_id_fkey",
      "message": "Only in the target",
      "severity": "warning",
      "source": "comparison"
    },
    {
      "certainty": "certain",
      "id": "x36c6f80d64c93154",
      "kind": "constraint_missing",
      "label": "tenant_a.line_items.line_items_qty_check",
      "message": "Only in the baseline",
      "severity": "warning",
      "source": "comparison"
    },
    {
      "certainty": "certain",
      "id": "x3ae7dedbaee6ab19",
      "kind": "table_changed",
      "label": "tenant_a.users",
      "message": "comment differ",
      "severity": "info",
      "source": "comparison"
    },
    {
      "certainty": "certain",
      "id": "x572bcdbbb296db20",
      "kind": "column_extra",
      "label": "tenant_b.users.phone",
      "message": "Only in the target",
      "severity": "error",
      "source": "comparison"
    },
    {
      "certainty": "certain",
      "id": "x616713e4cbe15f07",
      "kind": "index_missing",
      "label": "tenant_a.orders.orders_placed_at_idx",
      "message": "Only in the baseline",
      "severity": "warning",
      "source": "comparison"
    },
    {
      "certainty": "certain",
      "id": "x62b27f513574b3a0",
      "kind": "column_missing",
      "label": "tenant_a.users.legacy_code",
      "message": "Only in the baseline",
      "severity": "error",
      "source": "comparison"
    },
    {
      "certainty": "certain",
      "id": "x6327c1b461f122ed",
      "kind": "table_extra",
      "label": "tenant_b.refunds",
      "message": "Only in the target",
      "severity": "error",
      "source": "comparison"
    },
    {
      "certainty": "certain",
      "id": "x7495099d9aba44a3",
      "kind": "column_extra",
      "label": "tenant_b.line_items.coupon_id",
      "message": "Only in the target",
      "severity": "error",
      "source": "comparison"
    },
    {
      "certainty": "certain",
      "id": "x7675c1f7fc75d68d",
      "kind": "table_missing",
      "label": "tenant_a.products",
      "message": "Only in the baseline",
      "severity": "error",
      "source": "comparison"
    },
    {
      "certainty": "certain",
      "id": "x79d16d68eb709003",
      "kind": "column_missing",
      "label": "tenant_a.line_items.product_id",
      "message": "Only in the baseline",
      "severity": "error",
      "source": "comparison"
    },
    {
      "certainty": "certain",
      "id": "x7c5614d39591f580",
      "kind": "foreign_key_missing",
      "label": "tenant_a.line_items.line_items_product_id_fkey",
      "message": "Only in the baseline",
      "severity": "warning",
      "source": "comparison"
    },
    {
      "certainty": "certain",
      "id": "x7fcf2cd715cd8d4e",
      "kind": "foreign_key_changed",
      "label": "tenant_a.orders.orders_user_id_fkey",
      "message": "onDelete differ",
      "severity": "warning",
      "source": "comparison"
    },
    {
      "certainty": "certain",
      "id": "x8baed283f070954f",
      "kind": "index_changed",
      "label": "tenant_a.orders.orders_user_id_idx",
      "message": "name differ",
      "severity": "warning",
      "source": "comparison"
    },
    {
      "certainty": "certain",
      "id": "x8fe8383469f8f61b",
      "kind": "index_extra",
      "label": "tenant_b.orders.orders_total_idx",
      "message": "Only in the target",
      "severity": "warning",
      "source": "comparison"
    },
    {
      "certainty": "likely",
      "id": "x972bdcd6f09977e8",
      "kind": "column_changed",
      "label": "tenant_a.users.status",
      "message": "default differ",
      "severity": "warning",
      "source": "comparison"
    },
    {
      "certainty": "certain",
      "id": "x9923df11720e1e18",
      "kind": "primary_key_changed",
      "label": "tenant_a.line_items primary key",
      "message": "columns differ",
      "severity": "error",
      "source": "comparison"
    },
    {
      "certainty": "certain",
      "id": "xa6880ce102bef32d",
      "kind": "column_changed",
      "label": "tenant_a.orders.total",
      "message": "type differ",
      "severity": "warning",
      "source": "comparison"
    },
    {
      "certainty": "certain",
      "id": "xbd52e4f186cfbf3d",
      "kind": "table_missing",
      "label": "tenant_a.invoices",
      "message": "Only in the baseline",
      "severity": "error",
      "source": "comparison"
    },
    {
      "certainty": "certain",
      "id": "xca707e08038d401b",
      "kind": "column_changed",
      "label": "tenant_a.orders.placed_at",
      "message": "nullable differ",
      "severity": "warning",
      "source": "comparison"
    },
    {
      "certainty": "certain",
      "id": "xd3b67fd58cd1658d",
      "kind": "primary_key_missing",
      "label": "tenant_a.audit_events primary key",
      "message": "Only in the baseline",
      "severity": "error",
      "source": "comparison"
    },
    {
      "certainty": "certain",
      "id": "xda87e93f7e00389d",
      "kind": "primary_key_extra",
      "label": "tenant_b.settings primary key",
      "message": "Only in the target",
      "severity": "error",
      "source": "comparison"
    },
    {
      "certainty": "certain",
      "id": "xdaca713cc0b158a9",
      "kind": "column_extra",
      "label": "tenant_b.line_items.variant",
      "message": "Only in the target",
      "severity": "error",
      "source": "comparison"
    },
    {
      "certainty": "certain",
      "id": "xdd225ad2192585d0",
      "kind": "table_extra",
      "label": "tenant_b.coupons",
      "message": "Only in the target",
      "severity": "error",
      "source": "comparison"
    },
    {
      "certainty": "likely",
      "id": "xdd358392b863cf3a",
      "kind": "constraint_changed",
      "label": "tenant_a.orders.orders_total_check",
      "message": "expression differ",
      "severity": "warning",
      "source": "comparison"
    },
    {
      "certainty": "certain",
      "id": "xf36a69e9931c4c4f",
      "kind": "index_changed",
      "label": "tenant_a.users.users_name_idx",
      "message": "unique differ",
      "severity": "warning",
      "source": "comparison"
    },
    {
      "certainty": "certain",
      "id": "m0a5a5a0c80de4687",
      "kind": "migration_behind",
      "label": "alembic · tenant_partial",
      "message": "1 revisions are not applied",
      "severity": "error",
      "source": "migration"
    }
  ],
  "format": "laranex-schema-gate",
  "passed": false,
  "thresholds": {
    "certainty": "certain",
    "severity": "warning"
  },
  "version": "1.0"
}
